{
  "id": "550e8400-e29b-41d4-a716-446655440001",
  "chapter_id": "ch2",
  "question": "Explain what Rust is",
  "exercise_type": {
    "type": "short_answer",
    "model_answer": "Rust is a systems programming language",
    "key_points": ["systems programming", "memory safety", "performance"]
  },
  "difficulty": "medium",
  "max_score": 3.0
}
